{
  "schema": "zob.model-attempt.v1",
  "missionId": "mission-demo-001",
  "storyId": "H31",
  "gateId": "H31:G4",
  "taskId": "H31:G4:T2",
  "attemptId": "H31:G4:T2:A1",
  "assignmentId": "assign-V8M4",
  "rolePool": "development",
  "modelRoute": {"providerId": "provider-demo", "routeId": "route-demo", "modelId": "model-demo", "modelVersion": "version-demo", "adapterVersion": "adapter-demo"},
  "underlyingFamily": "family-demo",
  "requestedThinking": "low",
  "actualThinking": "low",
  "thinkingVerified": true,
  "promptTreatment": {"variantId": "prompt-control-v1", "mode": "uniform-control", "templateVersion": "1.0.0", "promptHash": "aaaaaaaaaaaaaaaaaaaaaaaaaaaaaaaaaaaaaaaaaaaaaaaaaaaaaaaaaaaaaaaa", "control": true},
  "policyVersions": {"modelPolicy": "baseline-1", "promptCatalog": "1.0.0"},
  "startedAt": "2026-07-18T10:05:00Z",
  "finishedAt": "2026-07-18T10:20:00Z",
  "outcome": "accepted",
  "failureClass": "none",
  "usage": {"inputTokens": 5000, "outputTokens": 1200, "costUsd": 0.5, "durationMs": 900000},
  "claimHash": "bbbbbbbbbbbbbbbbbbbbbbbbbbbbbbbbbbbbbbbbbbbbbbbbbbbbbbbbbbbbbbbb",
  "evidenceRef": "execution/evidence/tasks/H31-G4-T2.json",
  "bodyStored": false
}